{
  "schemaVersion": 1,
  "contract": "kungfu-buildchain-v4-capability-state-machine-manifest",
  "releaseLine": {
    "branch": "dev/v4/v4.0",
    "bootstrapAuthority": "architecture/v4-bootstrap-authority.json",
    "productionAuthority": "v4-native",
    "productionFallback": null,
    "rollbackRef": "release/v3/v3.0",
    "qualificationMode": "exact-n-minus-one-git-revision"
  },
  "dependencyLayers": [
    { "id": "contracts", "mayDependOn": [], "providerSdkImports": "forbidden" },
    {
      "id": "rust-domain",
      "mayDependOn": ["contracts"],
      "providerSdkImports": "forbidden"
    },
    {
      "id": "libnode-host",
      "mayDependOn": ["contracts", "rust-domain"],
      "providerSdkImports": "forbidden"
    },
    {
      "id": "typescript-adapters",
      "mayDependOn": ["contracts", "libnode-host"],
      "providerSdkImports": "adapter-only"
    },
    {
      "id": "workflows",
      "mayDependOn": ["contracts", "typescript-adapters"],
      "providerSdkImports": "adapter-only"
    },
    {
      "id": "legacy-compatibility",
      "mayDependOn": ["contracts", "typescript-adapters"],
      "providerSdkImports": "adapter-only"
    }
  ],
  "budgets": {
    "authority": {
      "hardCeilings": {
        "writersPerStateMachine": 1,
        "undeclaredAuthorities": 0,
        "permanentDualWrites": 0,
        "crossMachineMutableFiles": 0
      }
    },
    "semanticState": {
      "hardCeilings": {
        "undeclaredStates": 0,
        "undeclaredEvents": 0,
        "bypassTransitions": 0
      }
    },
    "boundary": {
      "hardCeilings": {
        "providerSdkImportsInContracts": 0,
        "providerSdkImportsInRustDomain": 0,
        "dependencyCycles": 0
      }
    },
    "structural": {
      "hardCeilings": {
        "unownedSourceFiles": 0,
        "unmappedCapabilities": 0,
        "manualProjectionCopies": 0
      }
    },
    "agentCognitive": {
      "hardCeilings": {
        "requiredDiscoveryCommands": 2,
        "duplicateArchitectureExplanations": 0,
        "implicitAuthorityDecisions": 0
      }
    },
    "recoveryFault": {
      "hardCeilings": {
        "stateMachinesWithoutRecovery": 0,
        "unboundedRetries": 0,
        "unknownFailureClasses": 0
      }
    }
  },
  "capabilities": [
    {
      "id": "next-development-controller",
      "owner": "Buildchain protected development version plane",
      "sourceInventoryId": "next-development-controller",
      "surfaces": [
        "cli:next-development",
        "export:./next-development-transition",
        "export:./next-development-controller",
        "export:./next-development-projection"
      ],
      "migrationPhase": "legacy-retired"
    },
    {
      "id": "dev-delivery-warrant",
      "owner": "Buildchain Dev delivery control plane",
      "sourceInventoryId": "dev-delivery-warrant",
      "surfaces": [
        "cli:dev",
        "export:./dev-delivery-warrant",
        "workflow:dev-pr-auto-merge"
      ],
      "migrationPhase": "legacy-retired"
    },
    {
      "id": "release-candidate-passport",
      "owner": "Buildchain candidate evidence plane",
      "sourceInventoryId": "release-candidate-passport",
      "surfaces": [
        "cli:candidate",
        "export:./release-candidate",
        "workflow:release-candidate-promote"
      ],
      "migrationPhase": "legacy-retired"
    },
    {
      "id": "release-candidate-recovery",
      "owner": "Buildchain promotion recovery plane",
      "sourceInventoryId": "release-candidate-recovery",
      "surfaces": [
        "export:./release-candidate-recovery",
        "workflow:buildchain-candidate-recovery-dogfood-failure"
      ],
      "migrationPhase": "legacy-retired"
    },
    {
      "id": "stable-candidate-ledger",
      "owner": "Buildchain stable release selection plane",
      "sourceInventoryId": "stable-candidate-ledger",
      "surfaces": [
        "export:./stable-candidate-ledger",
        "workflow:stable-candidate-patrol"
      ],
      "migrationPhase": "legacy-retired"
    },
    {
      "id": "publish-transaction",
      "owner": "Buildchain package and release publication plane",
      "sourceInventoryId": "publish-transaction",
      "surfaces": ["action:promote-buildchain-ref", "cli:release-transaction"],
      "migrationPhase": "legacy-retired"
    },
    {
      "id": "release-activation-transaction",
      "owner": "Buildchain release activation plane",
      "sourceInventoryId": "release-activation-transaction",
      "surfaces": ["export:./release-activation-transaction"],
      "migrationPhase": "legacy-retired"
    },
    {
      "id": "publication-authority",
      "owner": "Buildchain publication admission and qualification plane",
      "sourceInventoryId": "publication-authority",
      "surfaces": [
        "export:./publication-authority",
        "cli:verify-publication-admission"
      ],
      "migrationPhase": "legacy-retired"
    },
    {
      "id": "github-governance-authority",
      "owner": "Buildchain GitHub governance plane",
      "sourceInventoryId": "github-governance-authority",
      "surfaces": [
        "export:./github-governance-authority",
        "cli:release-governance"
      ],
      "migrationPhase": "legacy-retired"
    },
    {
      "id": "release-passport-and-artifact-proof",
      "owner": "Buildchain release trust plane",
      "sourceInventoryId": "release-passport-and-artifact-proof",
      "surfaces": ["export:./release-passport", "cli:verify-release-passport"],
      "migrationPhase": "legacy-retired"
    },
    {
      "id": "engineering-housekeeper",
      "owner": "Buildchain engineering hygiene plane",
      "sourceInventoryId": "engineering-housekeeper",
      "surfaces": [
        "export:./engineering-housekeeper",
        "export:./engineering-housekeeper-github",
        "workflow:engineering-housekeeper"
      ],
      "migrationPhase": "legacy-retired"
    },
    {
      "id": "release-propagation-work-control",
      "owner": "Buildchain downstream release propagation plane",
      "sourceInventoryId": "release-propagation-work-control",
      "surfaces": ["export:./release-propagation", "cli:release-propagation"],
      "migrationPhase": "legacy-retired"
    },
    {
      "id": "release-tail-provider-plane",
      "owner": "Buildchain declarative release provider plane",
      "sourceInventoryId": "release-tail-provider-plane",
      "surfaces": [
        "export:./release-tail-provider-plane",
        "cli:release-tail",
        "action:release-tail",
        "workflow:release-tail"
      ],
      "migrationPhase": "legacy-retired"
    }
  ],
  "stateMachines": [
    {
      "id": "next-development-controller",
      "capabilityId": "next-development-controller",
      "owner": "Buildchain protected development version plane",
      "writer": {
        "runtime": "typescript-v4",
        "authoritative": true,
        "secondWriterBudget": 0
      },
      "schemas": [
        "kungfu-buildchain-next-development-transition/v1",
        "kungfu-buildchain-next-development-controller/v1"
      ],
      "store": "atomic child store with compare-and-swap rooted checkpoints",
      "states": [
        "planned",
        "waiting-anchor",
        "materialized",
        "pr-pending",
        "merged",
        "verified"
      ],
      "events": [
        "schedule",
        "bind-reviewed-anchor",
        "materialize-current-dev",
        "open-protected-version-pr",
        "record-merge",
        "verify-protected-dev-readback"
      ],
      "invariants": [
        "completed Alpha remains terminal and immutable",
        "one deterministic child exists per completed-Alpha root",
        "verified requires exact protected Dev version and root readback"
      ],
      "effects": [
        "write declared version source and derived material",
        "request one protected Dev version pull request"
      ],
      "adapters": [
        "atomic durable child store",
        "version-state materialization adapter",
        "protected Dev pull-request and readback adapter"
      ],
      "tests": [
        "tests/next-development-transition.test.mjs",
        "tests/next-development-controller.test.mjs",
        "tests/next-development-self-dogfood.test.mjs",
        "tests/dev-alpha-candidate-patrol.test.mjs"
      ],
      "recovery": [
        "fresh runners resume the last rooted checkpoint and reuse idempotent materialization operations",
        "moved protected Dev supersedes only stale preparation and readback mismatch retries observation"
      ],
      "migrationPhase": "legacy-retired",
      "budgets": {
        "undeclaredStates": 0,
        "undeclaredEvents": 0,
        "unboundedRetries": 0
      }
    },
    {
      "id": "dev-delivery-warrant",
      "capabilityId": "dev-delivery-warrant",
      "owner": "Buildchain Dev delivery control plane",
      "writer": {
        "runtime": "typescript-v4",
        "authoritative": true,
        "secondWriterBudget": 0
      },
      "schemas": ["kungfu.buildchain.dev-delivery-warrant/v1"],
      "store": "rooted queue on the configured Git ref",
      "states": [
        "queued",
        "selected",
        "proving",
        "waiting",
        "blocked",
        "merged",
        "terminal-failure",
        "dequeued",
        "cancelled"
      ],
      "events": [
        "submit",
        "select",
        "lease",
        "renew",
        "recover-expired",
        "settle",
        "cancel"
      ],
      "invariants": [
        "one active fenced writer per protected base",
        "expected-old queue root must match"
      ],
      "effects": [
        "write Git-ref state commit",
        "request GitHub merge-queue admission"
      ],
      "adapters": ["Git ref adapter", "GitHub pull-request adapter"],
      "tests": [
        "tests/dev-delivery-warrant.test.mjs",
        "tests/dev-delivery-warrant-command.test.mjs"
      ],
      "recovery": [